{
  "$schema": "http://json-schema.org/draft-07/schema#",
  "title": "DeviceModel",
  "type": "object",
  "required": ["id", "name", "placement", "protocol", "bindings", "traits", "capabilities"],
  "properties": {
    "id": { "type": "string", "minLength": 1 },
    "name": { "type": "string", "minLength": 1 },
    "placement": {
      "type": "object",
      "required": ["room"],
      "properties": {
        "room": { "type": "string" },
        "zone": { "type": "string" },
        "floor": { "type": "string" },
        "mount": { "type": "string", "enum": ["ceiling", "wall", "desktop", "window", "floor"] },
        "description": { "type": "string" },
        "coordinates": {
          "type": "object",
          "properties": {
            "x": { "type": "number" },
            "y": { "type": "number" },
            "z": { "type": "number" },
            "lat": { "type": "number" },
            "lon": { "type": "number" },
            "unit": { "type": "string", "enum": ["m"] },
            "frame": { "type": "string", "enum": ["floorplan_image"] },
            "floorplanId": { "type": "string", "minLength": 1 },
            "source": { "type": "string", "enum": ["floorplan"] }
          },
          "allOf": [
            {
              "if": { "properties": { "source": { "const": "floorplan" } }, "required": ["source"] },
              "then": { "required": ["x", "y", "z", "unit", "frame", "floorplanId"] }
            }
          ],
          "additionalProperties": false
        }
      },
      "additionalProperties": false
    },
    "protocol": { "type": "string", "enum": ["zigbee", "wifi", "bluetooth_mesh", "matter", "virtual"] },
    "bindings": {
      "type": "object",
      "properties": {
        "zigbee2mqtt": {
          "type": "object",
          "properties": {
            "topic": { "type": "string" },
            "friendly_name": { "type": "string" },
            "ieee_address": { "type": "string" }
          },
          "required": ["topic"],
          "additionalProperties": false
        },
        "ha_entity_id": { "type": "string" },
        "ha": {
          "type": "object",
          "properties": {
            "entity_id": { "type": "string" }
          },
          "required": ["entity_id"],
          "additionalProperties": false
        },
        "voice_control": {
          "type": "object",
          "required": ["wake", "actions"],
          "properties": {
            "transport": { "type": "string", "enum": ["local_tts", "ws_satellite"] },
            "priority": { "type": "string", "enum": ["prefer", "fallback"] },
            "audio_output": { "type": "string" },
            "preferred_mics": { "type": "array", "items": { "type": "string" } },
            "satellite": {
              "type": "object",
              "required": ["endpoint", "device_id"],
              "properties": {
                "endpoint": { "type": "string", "minLength": 1 },
                "device_id": { "type": "string", "minLength": 1 },
                "auth_token": { "type": "string" },
                "protocol_version": { "type": "string" },
                "input_audio": {
                  "type": "object",
                  "properties": {
                    "encoding": { "type": "string", "enum": ["pcm_s16le"] },
                    "sample_rate_hz": { "type": "integer", "minimum": 1 },
                    "channels": { "type": "integer", "minimum": 1 },
                    "frame_samples": { "type": "integer", "minimum": 1 }
                  },
                  "additionalProperties": false
                },
                "output_audio": {
                  "type": "object",
                  "properties": {
                    "encoding": { "type": "string", "enum": ["pcm_s16le"] },
                    "sample_rate_hz": { "type": "integer", "minimum": 1 },
                    "channels": { "type": "integer", "minimum": 1 },
                    "frame_samples": { "type": "integer", "minimum": 1 }
                  },
                  "additionalProperties": false
                }
              },
              "additionalProperties": false
            },
            "wake": {
              "type": "object",
              "required": ["utterances"],
              "properties": {
                "utterances": { "type": "array", "minItems": 1, "items": { "type": "string", "minLength": 1 } },
                "retries": { "type": "integer", "minimum": 0 },
                "gap_ms": { "type": "integer", "minimum": 0 }
              },
              "additionalProperties": false
            },
            "ack": {
              "type": "object",
              "properties": {
                "keywords": { "type": "array", "items": { "type": "string", "minLength": 1 } },
                "timeout_ms": { "type": "integer", "minimum": 100 },
                "listen_window_ms": { "type": "integer", "minimum": 100 }
              },
              "additionalProperties": false
            },
            "actions": {
              "type": "object",
              "minProperties": 1,
              "patternProperties": {
                "^[A-Za-z0-9_.:-]+$": {
                  "type": "object",
                  "required": ["utterances"],
                  "properties": {
                    "utterances": { "type": "array", "minItems": 1, "items": { "type": "string", "minLength": 1 } },
                    "deterministic": { "type": "boolean" },
                    "slot_schema": {
                      "type": "object",
                      "patternProperties": {
                        "^[A-Za-z0-9_.:-]+$": {
                          "type": "object",
                          "properties": {
                            "type": { "type": "string", "enum": ["boolean", "number", "string", "enum"] },
                            "minimum": { "type": "number" },
                            "maximum": { "type": "number" },
                            "enum": { "type": "array", "items": { "type": "string" } },
                            "required": { "type": "boolean" }
                          },
                          "additionalProperties": false
                        }
                      },
                      "additionalProperties": false
                    },
                    "pre_delay_ms": { "type": "integer", "minimum": 0 },
                    "post_delay_ms": { "type": "integer", "minimum": 0 },
                    "interrupt_phrases": { "type": "array", "items": { "type": "string", "minLength": 1 } },
                    "risk": { "type": "string", "enum": ["low", "medium", "high"] }
                  },
                  "additionalProperties": false
                }
              },
              "additionalProperties": false
            }
          },
          "allOf": [
            {
              "if": {
                "properties": {
                  "transport": { "const": "ws_satellite" }
                },
                "required": ["transport"]
              },
              "then": {
                "required": ["satellite"]
              }
            }
          ],
          "additionalProperties": false
        },
        "vendor_extra": { "type": "object" }
      },
      "additionalProperties": false
    },
    "traits": {
      "type": "object",
      "properties": {
        "switch": {
          "type": "object",
          "properties": {
            "state": { "type": "string", "enum": ["on", "off"] },
            "power_w": { "type": "number" },
            "energy_kwh": { "type": "number" }
          },
          "required": ["state"],
          "additionalProperties": false
        },
        "dimmer": {
          "type": "object",
          "properties": {
            "state": { "type": "string", "enum": ["on", "off"] },
            "brightness": { "type": "number", "minimum": 0, "maximum": 100 }
          },
          "required": ["state"],
          "additionalProperties": false
        },
        "climate": {
          "type": "object",
          "properties": {
            "mode": { "type": "string", "enum": ["off", "heat", "cool", "auto", "dry", "fan_only"] },
            "target_temperature_c": { "type": "number" },
            "current_temperature_c": { "type": "number" },
            "fan_mode": { "type": "string", "enum": ["off", "low", "medium", "high", "auto"] },
            "humidity_percent": { "type": "number" }
          },
          "required": ["mode"],
          "additionalProperties": false
        },
        "cover": {
          "type": "object",
          "properties": {
            "position_percent": { "type": "number", "minimum": 0, "maximum": 100 },
            "state": { "type": "string", "enum": ["opening", "closing", "stopped"] }
          },
          "additionalProperties": false
        },
        "telemetry": {
          "type": "object",
          "properties": {
            "last_seen": { "type": "string" },
            "battery_percent": { "type": "number" },
            "linkquality": { "type": "number" },
            "signal_dbm": { "type": "number" }
          },
          "additionalProperties": false
        }
      },
      "additionalProperties": false
    },
    "capabilities": {
      "type": "array",
      "items": {
        "type": "object",
        "required": ["action"],
        "properties": {
          "action": { "type": "string" },
          "description": { "type": "string" },
          "parameters": {
            "type": "array",
            "items": {
              "type": "object",
              "required": ["name", "type"],
              "properties": {
                "name": { "type": "string" },
                "type": { "type": "string", "enum": ["boolean", "number", "string", "enum"] },
                "minimum": { "type": "number" },
                "maximum": { "type": "number" },
                "enum": { "type": "array", "items": { "type": "string" } },
                "required": { "type": "boolean" },
                "description": { "type": "string" }
              },
              "additionalProperties": false
            }
          }
        },
        "additionalProperties": false
      }
    },
    "semantics": {
      "type": "object",
      "properties": {
        "summary": { "type": "string" },
        "tags": { "type": "array", "items": { "type": "string" } },
        "aliases": { "type": "array", "items": { "type": "string" } },
        "preferred_scenes": { "type": "array", "items": { "type": "string" } },
        "constraints": { "type": "array", "items": { "type": "string" } },
        "owner_notes": { "type": "string" },
        "description": { "type": "string" },
        "vendor": { "type": "string" },
        "model": { "type": "string" }
      },
      "additionalProperties": false
    },
    "identity": {
      "type": "object",
      "properties": {
        "stableKey": { "type": "string", "minLength": 1 },
        "fingerprint": { "type": "object" },
        "aliasKeys": {
          "type": "array",
          "items": { "type": "string", "minLength": 1 }
        }
      },
      "additionalProperties": false
    }
  },
  "additionalProperties": false
}
